{
  "schema": "vortik_reception_observation/1.0.0",
  "event_id": "event-123",
  "observed_at": "2026-09-14T01:30:00.000Z",
  "surface": "public_a2a_reception",
  "intent": "commercial_interest",
  "status": "recognized",
  "route": "sanitized_signal_only",
  "confidence": "high",
  "priority": "high",
  "commercial_signal": true,
  "identifier": "epbs.eth",
  "inbound_message_id_digest": "sha256:2a0a34e40447c4764087a2ae68b8e75892a761f0628e986c4489f4112c62998c",
  "context_id_digest": "sha256:981206b0523868a0f3fd83d9be4d8a9461d78c485c5e7e5e356e116eace9fa06",
  "response_message_id_digest": "sha256:a44d14b53bd9d54407a047fa3d88439832ad87b8c3b815eff4983901f22f0633"
}
